Article Title,Article Link,Date,Age (days),Category,Page Number
Saving More than Kenneth Bae: US foreign policy in North Korea,/2014/02/25/saving-more-than-kenneth-bae-us-foreign-policy-in-north-korea/,2014-02-25,98,Opinions,1
De Blasio Promises Best Plan for Universal Pre-K,/2014/02/24/de-blasio-promises-best-plan-for-universal-pre-k/,2014-02-24,99,Opinions,1
Google it?,/2013/12/17/google-it/,2013-12-17,168,Opinions,1
Shutdown 2013: Acts of Self-Interest,/2013/11/18/shutdown-2013-self-interest/,2013-11-18,197,Opinions,2
A Big Stuff Moment,/2013/11/13/a-big-stuff-moment/,2013-11-13,202,Opinions,2
Dear Mr. Putin: Can I call you Vlad?,/2013/10/22/dear-mr-putin-can-i-call-you-vlad/,2013-10-22,224,Opinions,2
What Happens to a Dream Deferred?,/2013/10/22/a-dream-deferred/,2013-10-22,224,Opinions,3
Wail to the Chief,/2013/10/22/wail-to-the-chief/,2013-10-22,224,Opinions,3
Politically Incorrect Maroon Confessions,/2013/08/05/politically-incorrect-maroon-confessions/,2013-08-05,302,Opinions,3
Why we Should Care a Woman Led the Greatest Manhunt in History,/2013/07/20/a-woman-led-the-greatest-manhunt-in-history-why-should-we-care/,2013-07-20,318,Opinions,4
UCPU Debate: Corporate Greed,/2014/03/28/ucpu-debate-corporate-greed/,2014-03-28,67,Column: UCPU,1
UCPU Debate: Humanitarian Intervention,/2014/02/12/ucpu-debate-humanitarian-intervention/,2014-02-12,111,Column: UCPU,1
Coming Soon: UChicago Political Union,/2014/01/21/coming-soon-uchicago-political-union/,2014-01-21,133,Column: UCPU,1
A Wall Around Hyde Park: The History and the Future of the UCPD,/2014/06/02/a-wall-around-hyde-park/,2014-06-02,1,Chicago,1
State Reps Attack Illinois State Charter School Commission,/2014/05/14/state-reps-attack-illinois-state-charter-school-commission/,2014-05-14,20,Chicago,1
A Chicagoan Reviews Chicagoland  Episode 8,/2014/05/11/a-chicagoan-reviews-chicagoland-episode-8/,2014-05-11,23,Chicago,1
Senators Mark Kirk and Dick Durbin: A rare bipartisan bromance?,/2014/05/04/senators-mark-kirk-and-dick-durbin-a-rare-bipartisan-bromance/,2014-05-04,30,Chicago,2
A Chicagoan Reviews Chicagoland  Episode 7,/2014/05/01/a-chicagoan-reviews-chicagoland-episode-7/,2014-05-01,33,Chicago,2
Cracks in the Basin  Part 4: Epilogue: Literally divided now,/2014/04/19/epilogue/,2014-04-19,45,Chicago,2
A Chicagoan Reviews Chicagoland  Episode 6,/2014/04/19/a-chicagoan-reviews-chicagoland-episode-6/,2014-04-19,45,Chicago,3
Riding with Strangers: Regulating ride-sharing in Chicago and Illinois,/2014/04/14/riding-with-strangers-regulating-ride-sharing-in-chicago-and-illinois/,2014-04-14,50,Chicago,3
A Chicagoan Reviews Chicagoland  Episode 5,/2014/04/07/a-chicagoan-reviews-chicagoland-episode-5/,2014-04-07,57,Chicago,3
A Chicagoan Reviews Chicagoland  Episode 4,/2014/04/06/a-chicagoan-reviews-chicagoland-episode-4/,2014-04-06,58,Chicago,4
A Chicagoan Reviews Chicagoland  Episode 3,/2014/03/29/a-chicagoan-reviews-chicagoland-episode-3/,2014-03-29,66,Chicago,4
A Chicagoan Reviews Chicagoland  Episode 2,/2014/03/25/a-chicagoan-reviews-chicagoland-episode-2/,2014-03-25,70,Chicago,4
A Chicagoan Reviews Chicagoland  Episode 1,/2014/03/19/a-chigoan-reviews-chicagoland-episode-1/,2014-03-19,76,Chicago,5
GOP Forum: Rauners opponents on the offensive,/2014/03/10/gop-forum/,2014-03-10,85,Chicago,5
Mayor Emanuel Gets Schooled,/2014/02/10/mayor-emanuel-gets-schooled/,2014-02-10,113,Chicago,5
State of the State: Governor Quinn unofficially kicks off his campaign,/2014/02/06/illinois-state-of-the-state-governor-quinn-unofficially-kicks-off-his-campaign/,2014-02-06,117,Chicago,6
Cracks in the Basin  Part 3: The Whole County is Fracked,/2014/02/06/cracks-in-the-basin-part-3-the-whole-county-is-fracked/,2014-02-06,117,Chicago,6
"Cracks in the Basin  Part 2: Big Greens, Little Greens, and a Fractured Opposition",/2014/01/24/cracks-in-the-basin-part-2-big-greens-little-greens-and-a-fractured-opposition/,2014-01-24,130,Chicago,6
Cracks in the Basin  Part 1: Illinois: A National Model?,/2014/01/16/cracks-in-the-basin-part-1-illinois-a-national-model/,2014-01-16,138,Chicago,7
Illinois Without Career Politicians?,/2013/11/25/illinois-without-career-politicians/,2013-11-25,190,Chicago,7
Officials Review Response to 2008 Crisis,/2013/11/22/officials-review-response-to-2008-crisis/,2013-11-22,193,Chicago,7
Proposed Bike Registration Sparks Generational Divide,/2013/11/20/proposed-bike-tax-chicago/,2013-11-20,195,Chicago,8
Republicans Moving in on Illinois Gubernatorial Race,/2013/10/29/republicans-illinois-gubernatorial-race/,2013-10-29,217,Chicago,8
Bike Sharing Expands In the Windy City,/2013/06/20/bike-sharing-expands-in-the-windy-city/,2013-06-20,348,Chicago,8
Review: Last Week Tonight with John Oliver,/2014/05/29/review-last-week-tonight-with-john-oliver/,2014-05-29,5,Arts & Culture,1
Chiraq: An unbalanced portrayal of drill music,/2014/02/28/chiraq-an-unbalanced-portrayal-of-drill-music/,2014-02-28,95,Arts & Culture,1
Pop Culture Podcast: Episode 1,/2014/02/24/pop-culture-podcast-episode-1/,2014-02-24,99,Arts & Culture,1
The Flame of Love in Catching Fire,/2014/01/27/the-flame-of-love-in-catching-fire/,2014-01-27,127,Arts & Culture,2
Instagram Featuring Dictators,/2013/12/06/instagram-featuring-dictators/,2013-12-06,179,Arts & Culture,2
Crossing Blurred Lines: Did Robin Thicke plagiarize his hit single?,/2013/11/26/thick-blurred-lines-plagiarism/,2013-11-26,189,Arts & Culture,2
Years in the Making: Is Hollywood ready to talk seriously about slavery?,/2013/11/22/years-in-the-making-is-hollywood-finally-ready-to-talk-seriously-about-slavery/,2013-11-22,193,Arts & Culture,3
The Captain Has the Con: Fact and Fiction in Captain Phillips,/2013/11/14/the-captain-has-the-con-fact-and-fiction-in-captain-phillips/,2013-11-14,201,Arts & Culture,3
Objects in Space: The Gravity of Hollywoods Portrayal of Science,/2013/10/29/gravity-movie-and-science/,2013-10-29,217,Arts & Culture,3
"Move Over, Press Secretary: Pols play with Instagram",/2013/10/22/russian-pols-instagram/,2013-10-22,224,Arts & Culture,4
Review: Alpha House,/2013/06/12/review-alpha-house/,2013-06-12,356,Arts & Culture,4
The State of Opinion Writing: An Interview with Frank Rich,/2014/05/28/the-state-of-opinion-writing-an-interview-with-frank-rich/,2014-05-28,6,Interviews,1
Kasim Reed: Atlantas Decisive Leader,/2014/05/16/kasim-reed-atlantas-decisive-leader/,2014-05-16,18,Interviews,1
Ana Navarro: A Republican on the rise,/2014/04/15/ana-navarro-rising-republican-adviser-weighs-in-on-women-hispanics-and-the-gop/,2014-04-15,49,Interviews,1
In the Minority: An Interview with Reps Kelly (R-NY) and Davis (D-TN),/2014/02/19/in-the-minority-an-interview-with-representatives-kelly-r-ny-and-davis-d-tn/,2014-02-19,104,Interviews,2
Tommy Vietor: Bridging the gap between the public and the classified,/2014/01/24/tommy-vietor-bridging-the-gap-between-the-public-and-the-classified/,2014-01-24,130,Interviews,2
Jon Favreau: The voice behind a generational voice,/2013/12/01/jon-favreau-the-voice-behind-a-generational-voice/,2013-12-01,184,Interviews,2
Claire McCaskill: A leading voice on both sides of the aisle,/2013/11/21/claire-mccaskill-a-leading-voice-on-both-sides-of-the-aisle/,2013-11-21,194,Interviews,3
Mark Leibovich: A conscious eye on a self-conscious city,/2013/11/06/mark-leibovich-a-conscious-eye-on-a-self-conscious-city/,2013-11-06,209,Interviews,3
John McCain: A statesman fit for compromise,/2013/11/01/john-mccain-a-statesman-fit-for-compromise/,2013-11-01,214,Interviews,3
Ed Gillespie: A discussion with a Republican strategist,/2013/10/30/interview-with-ed-gillespie/,2013-10-30,216,Interviews,4
George Packer: Defending the Ordinary,/2013/10/15/interview-george-packer/,2013-10-15,231,Interviews,4
Chinese Companies on US Exchanges: Is this time different?,/2014/05/15/chinese-companies-on-us-exchanges-is-this-time-different/,2014-05-15,19,US,1
Incentivizing Education: Performance-based compensation for teachers,/2014/04/29/incentivizing-education-performance-based-compensation-for-teachers/,2014-04-29,35,US,1
Deportations and their Role in Immigration Policy,/2014/04/27/deportations-and-their-role-in-immigration-policy/,2014-04-27,37,US,1
New CEOs Controversial Resignation From Mozilla Corporation,/2014/04/21/new-ceos-controversial-resignation-from-mozilla-corporation/,2014-04-21,43,US,2
De Blasios Education Promises,/2014/04/07/de-blasios-education-promises/,2014-04-07,57,US,2
Mandatory Minimums: Cooperation on reform?,/2014/04/06/mandatory-minimums-cooperation-on-reform/,2014-04-06,58,US,2
Where are the Pragmatists? Cantors foreign policy and the Republican response,/2014/03/17/where-are-the-pragmatists-cantors-foreign-policy-and-the-republican-response/,2014-03-17,78,US,3
Vergara v. California v. Students?,/2014/03/04/vergara-v-california-v-students/,2014-03-04,91,US,3
Shelby County v. Holder: A setback for liberal voting rights activists,/2014/02/28/shelby-county-v-holder-a-setback-for-liberal-voting-rights-activists/,2014-02-28,95,US,3
House Republicans Take Vine: Social media and political discourse,/2014/02/25/house-republicans-take-vine-social-media-and-political-discourse/,2014-02-25,98,US,4
De Blasio Promises Best Plan for Universal Pre-K,/2014/02/24/de-blasio-promises-best-plan-for-universal-pre-k/,2014-02-24,99,US,4
State of the Union Review,/2014/02/07/state-of-the-union-review/,2014-02-07,116,US,4
The Year After the Year of the MOOC,/2014/01/28/years-after-mooc/,2014-01-28,126,US,5
Six Blind Reformers and an Elephant,/2013/12/17/six-blind-reformers-and-an-elephant/,2013-12-17,168,US,5
"The Old, the Young, and the Inter-generational Transfer of Wealth",/2013/12/13/the-old-the-young-and-the-inter-generational-transfer-of-wealth/,2013-12-13,172,US,5
Race to Mars,/2013/12/10/race-to-mars/,2013-12-10,175,US,6
J.P. Morgan Pays $13 Billion in Fines: Is it enough?,/2013/12/03/jp-morgan-fines/,2013-12-03,182,US,6
"Raise Scores, Then Wages",/2013/11/21/raise-scores-then-wages/,2013-11-21,194,US,6
Feinstein Stands by the NSA,/2013/11/18/feinstein-stands-by-the-nsa/,2013-11-18,197,US,7
The True Meaning of the Shutstorm,/2013/11/13/the-true-meaning-of-the-shutstorm/,2013-11-13,202,US,7
Wendy Davis and the Battle for Texas,/2013/10/31/wendy-davis-texas/,2013-10-31,215,US,7
Democrat Shutdown Strategy,/2013/10/18/democratic-strategy-during-and-after-the-shutdown/,2013-10-18,228,US,8
A Way Out of the Debt Ceiling Debacle,/2013/10/16/debt-ceiling-debacle/,2013-10-16,230,US,8
Inside the Debate on Healthcare,/2013/09/30/inside-the-debate-on-healthcare/,2013-09-30,246,US,8
Fracking in California,/2013/07/20/fracking-in-california/,2013-07-20,318,US,9
The Aftermath of an Avalanche,/2014/05/11/1204/,2014-05-11,23,World,1
Childs Play: The curious problem with Pakistans judicial system,/2014/04/28/childs-play-the-curious-problem-with-pakistans-judicial-system/,2014-04-28,36,World,1
Protests in Venezuela: Why now?,/2014/03/18/protests-in-venezuela/,2014-03-18,77,World,1
Vandalizing the Diary of Anne Frank: Shift of sentiment or colossal coincidence?,/2014/03/17/vandalizing-the-diary-of-anne-frank-shift-of-sentiment-or-colossal-coincidence/,2014-03-17,78,World,2
Fighting Words,/2014/03/17/fighting-words/,2014-03-17,78,World,2
In Putins Shoes,/2014/03/10/in-putins-shoes/,2014-03-10,85,World,2
Crisis in Turkey: Arrests reveal the dark sides of former allies,/2014/03/05/crisis-in-turkey-arrests-reveal-the-dark-sides-of-former-allies/,2014-03-05,90,World,3
"Private Lives, Public Figures: The politics of Frances First Lady",/2014/02/18/private-lives-public-figures-the-politics-of-frances-first-lady/,2014-02-18,105,World,3
China Invests in Africa,/2014/02/13/china-invests-in-africa/,2014-02-13,110,World,3
Taking Safety into Their Own Hands,/2014/02/01/taking-safety-into-their-own-hands/,2014-02-01,122,World,4
Anti-Gay Law in Nigeria,/2014/01/31/anti-gay-law-in-nigeria/,2014-01-31,123,World,4
Panda Diplomacy,/2014/01/31/panda-diplomacy/,2014-01-31,123,World,4
Rohingya Refugees: Trapped between Arakan and a hard place,/2013/12/20/rohingya-refugees-trapped-between-arakan-and-a-hard-place/,2013-12-20,165,World,5
"France, Israel, and the Future of Iranian Nuclear Talks",/2013/12/15/france-israel-and-the-future-of-iranian-nuclear-talks/,2013-12-15,170,World,5
Race to Mars,/2013/12/10/race-to-mars/,2013-12-10,175,World,5
Who Are The Indian Mujahideen?,/2013/12/05/who-are-the-indian-mujahideen/,2013-12-05,180,World,6
"Turkey: One Step Forward, Two Steps Back",/2013/12/04/turkey-one-step-forward-two-steps-back/,2013-12-04,181,World,6
Nazi-looted Art Finally Uncovered,/2013/11/29/nazi-looted-art-finally-uncovered/,2013-11-29,186,World,6
Violence Continues in Egypt,/2013/11/29/violence-continues-in-egypt/,2013-11-29,186,World,7
Suriname and Hezbollah,/2013/11/28/suriname-and-hezbollah/,2013-11-28,187,World,7
Damage-Control Diplomacy: Kerrys Visit to Saudi Arabia,/2013/11/21/damage-control-diplomacy-kerrys-visit-to-saudi-arabia/,2013-11-21,194,World,7
Election Violence in the Philippines,/2013/11/20/election-violence-in-the-philippines/,2013-11-20,195,World,8
Superfood to the Rescue?,/2013/11/15/superfood-to-the-rescue/,2013-11-15,200,World,8
Malaysian Court Rules Against Minorities Right to Use Allah,/2013/11/15/malaysian-court-minorities-allah/,2013-11-15,200,World,8
Syria and Sectarianism: Spillover Violence in Lebanon,/2013/11/14/syria-and-sectarianism-spillover-violence-in-lebanon/,2013-11-14,201,World,9
Interview with Farah Al Haddad,/2013/11/12/farah-al-haddad-interview/,2013-11-12,203,World,9
From Bread Lines to the Front Lines,/2013/11/05/bread-lines-to-front-lines/,2013-11-05,210,World,9
Migrants Marooned: The Italian immigration crisis deepens,/2013/11/05/migrants-marooned-italian-immigration-crisis/,2013-11-05,210,World,10
Is Le Pen Mightier?,/2013/10/30/is-le-pen-mightier/,2013-10-30,216,World,10
Magnitsky: The perils of whistle-blowing in Russia,/2013/10/28/magnitsky-russia/,2013-10-28,218,World,10
Outside the Bubble: How foreign media covered the shutdown,/2013/10/22/foreign-media-on-us-shutdown/,2013-10-22,224,World,11
Turkey: Reforms of self-interest,/2013/10/22/turkey-reforms-of-self-interest/,2013-10-22,224,World,11
Vladimir Zhirinovsky: A Profile,/2013/07/15/vladimir-zhirinovsky-a-profile-in-outrage/,2013-07-15,323,World,11
From Palestine to Syria to Palestine again: generations of strife for Palestinian refugees,/2013/07/01/palestinian-refugee-strife/,2013-07-01,337,World,12
Kerry Pushes for Peace,/2013/06/24/kerrys-push-for-peace/,2013-06-24,344,World,12
The Serengeti Sell-Off,/2013/06/22/the-serengeti-sell-off/,2013-06-22,346,World,12
A System In Rags,/2013/06/17/a-system-in-rags/,2013-06-17,351,World,13
To Build a Future,/2014/05/12/to-build-a-future/,2014-05-12,22,Column: Rxeform,1
Closing the Gap,/2014/04/21/closing-the-gap/,2014-04-21,43,Column: Rxeform,1
Two Twenty Four,/2014/04/07/two-twenty-four/,2014-04-07,57,Column: Rxeform,1
Fixing the Big Ms,/2014/03/10/fixing-the-big-ms/,2014-03-10,85,Column: Rxeform,2
Health Beyond Medicine,/2014/02/24/health-beyond-medicine/,2014-02-24,99,Column: Rxeform,2
Why Insurance?: Part 3  Cost of Care,/2014/02/10/why-insurance-part-3-cost-of-care/,2014-02-10,113,Column: Rxeform,2
Why Insurance?: Part 2  Access,/2014/01/27/why-insurance-part-2-access/,2014-01-27,127,Column: Rxeform,3
Why Insurance?: Part 1  Health,/2014/01/13/why-insurance-part-1-health/,2014-01-13,141,Column: Rxeform,3
The Unconquered,/2013/12/02/the-unconquered/,2013-12-02,183,Column: Rxeform,3
Healthcare Reform: Today and Tomorrow,/2013/11/19/healthcare-reform-today-and-tomorrow/,2013-11-19,196,Column: Rxeform,4
Introducing: Rxeform,/2013/10/27/introducing-rxeform/,2013-10-27,219,Column: Rxeform,4
Tackling Affirmative Action: SCOTUS examines Michigans ban,/2014/05/14/tackling-affirmative-action-scotus-examines-michigans-ban/,2014-05-14,20,Column: Supreme Court Spotlight,1
A New ACA Case: SCOTUS takes on question of religious liberties,/2014/04/21/a-new-aca-case-scotus-takes-on-question-of-religious-liberties/,2014-04-21,43,Column: Supreme Court Spotlight,1
How Will History Remember It?: Legacy of the 2012-2013 Supreme Court term,/2014/04/04/legacy-of-the-2012-2013-supreme-court/,2014-04-04,60,Column: Supreme Court Spotlight,1
Preview: Supreme Court 2013-2014 Term,/2014/02/28/preview-supreme-court-2013-2014-term/,2014-02-28,95,Column: Supreme Court Spotlight,2
Recess Appointments: Did Obama go too far?,/2014/01/30/recess-appointments-did-obama-go-too-far/,2014-01-30,124,Column: Supreme Court Spotlight,2
Utah Strikes Back: The next stages in the battle for same-sex marriage,/2014/01/24/utah-strikes-back-the-next-stages-in-the-battle-for-same-sex-marriage/,2014-01-24,130,Column: Supreme Court Spotlight,2
Introducing: Supreme Court Spotlight,/2014/01/22/introducing-supreme-court-spotlight-2/,2014-01-22,132,Column: Supreme Court Spotlight,3
Perspectives,/2014/04/13/1109/,2014-04-13,51,Column: Cartoons,1
Putin and Obama Take on Sochi,/2014/03/09/putin-and-obama-take-on-sochi/,2014-03-09,86,Column: Cartoons,1
No Mans Land,/2014/04/25/no-mans-land/,2014-04-25,39,Column: Shatter Zones,1
Border Diplomacy: Why Afghanistan Supports a Russian Crimea,/2014/04/07/border-diplomacy-why-afghanistan-supports-a-russian-crimea/,2014-04-07,57,Column: Shatter Zones,1
"So Long, and Thanks for All the Fish: Understanding the ICJ ruling on the Chile-Peru border dispute",/2014/02/06/so-long-and-thanks-for-all-the-fish-understanding-the-icj-ruling-on-the-chile-peru-border-dispute/,2014-02-06,117,Column: Shatter Zones,1
Demarcating Chinas Imaginary Valleys,/2013/11/28/demarcating-chinas-imaginary-valleys/,2013-11-28,187,Column: Shatter Zones,2
Patrolling the Worlds Most Complicated Frontier,/2013/11/10/patrolling-the-worlds-most-complicated-frontier/,2013-11-10,205,Column: Shatter Zones,2
Introducing: Shatter Zones,/2013/10/27/introducing_shatterzones/,2013-10-27,219,Column: Shatter Zones,2
